{
  "$schema": "http://json-schema.org/draft-07/schema#",
  "$id": "https://github.com/lavneethora/TechPark/contracts/state.schema.json",
  "title": "ParkTech live state message",
  "description": "One state message, broadcast over the WebSocket whenever occupancy changes. This is the interface between the vision lane and the web lane. Additive changes only: fields may be added, never renamed or removed.",
  "type": "object",
  "required": ["camera_id", "timestamp", "spots", "cars", "summary"],
  "additionalProperties": true,
  "properties": {
    "camera_id": {
      "type": "string",
      "description": "Which camera zone this state describes."
    },
    "timestamp": {
      "type": "string",
      "format": "date-time",
      "description": "UTC timestamp of the frame this state was derived from."
    },
    "spots": {
      "type": "object",
      "description": "Keyed by spot id. Every monitored spot appears every message.",
      "additionalProperties": {
        "type": "object",
        "required": ["status"],
        "properties": {
          "status": {
            "enum": ["occupied", "available", "held"],
            "description": "held means a driver has claimed it and it is not offered to anyone else."
          },
          "confidence": {
            "type": ["number", "null"],
            "minimum": 0,
            "maximum": 1,
            "description": "Detector confidence for an occupied spot. Null when available."
          },
          "vehicle_id": {
            "type": ["integer", "null"],
            "description": "ByteTrack id of the vehicle in this spot, when known."
          },
          "held_until": {
            "type": ["string", "null"],
            "format": "date-time",
            "description": "Present only when status is held."
          }
        }
      }
    },
    "cars": {
      "type": "array",
      "description": "Vehicles in monitored stalls, in normalized top-down coordinates. Already warped server side; the frontend never does geometry. Only cars occupying a monitored stall appear: the camera sees the whole lot, and publishing every detection scattered dots across the map with no stall under them.",
      "items": {
        "type": "object",
        "required": ["id", "x", "y"],
        "properties": {
          "id": {
            "type": "integer",
            "description": "Stable while the vehicle stays parked. Issued when a stall fills and retired when it empties, rather than by frame to frame motion tracking, which cannot work across frames five minutes apart."
          },
          "x": { "type": "number", "minimum": 0, "maximum": 1 },
          "y": { "type": "number", "minimum": 0, "maximum": 1 },
          "spot_id": {
            "type": "string",
            "description": "Which stall this vehicle occupies. Lets the twin draw a car onto its stall without redoing the geometry."
          }
        }
      }
    },
    "summary": {
      "type": "object",
      "required": ["total", "occupied", "available"],
      "properties": {
        "total": { "type": "integer" },
        "occupied": { "type": "integer" },
        "available": { "type": "integer" },
        "accuracy": {
          "type": ["number", "null"],
          "minimum": 0,
          "maximum": 1,
          "description": "Running per-spot accuracy against dataset ground truth."
        }
      }
    },
    "best_spot": {
      "type": ["string", "null"],
      "description": "Nearest available spot to the entrance, excluding held spots."
    },
    "last_event": {
      "type": ["object", "null"],
      "description": "The most recent state transition, for the activity feed. Null when nothing changed.",
      "required": ["spot_id", "from", "to"],
      "properties": {
        "spot_id": { "type": "string" },
        "from": { "enum": ["occupied", "available", "held"] },
        "to": { "enum": ["occupied", "available", "held"] },
        "vehicle_id": {
          "type": ["integer", "null"],
          "description": "The vehicle that arrived or left, so the feed can say \"Vehicle 27 left stall 28\" rather than just naming the stall."
        }
      }
    }
  }
}
