{
  "camera_id": "PUCPR",
  "timestamp": "2012-10-29T08:32:58Z",
  "spots": {
    "1": {
      "status": "occupied",
      "confidence": 0.71,
      "vehicle_id": 3085
    },
    "2": {
      "status": "occupied",
      "confidence": 0.71,
      "vehicle_id": 3090
    },
    "3": {
      "status": "occupied",
      "confidence": 0.71,
      "vehicle_id": 3075
    },
    "4": {
      "status": "occupied",
      "confidence": 0.71,
      "vehicle_id": 3091
    },
    "5": {
      "status": "occupied",
      "confidence": 0.71,
      "vehicle_id": 3079
    },
    "6": {
      "status": "occupied",
      "confidence": 0.71,
      "vehicle_id": 3086
    },
    "7": {
      "status": "occupied",
      "confidence": 0.71,
      "vehicle_id": 3092
    },
    "8": {
      "status": "occupied",
      "confidence": 0.71,
      "vehicle_id": 3087
    },
    "9": {
      "status": "occupied",
      "confidence": 0.71,
      "vehicle_id": 3093
    },
    "10": {
      "status": "occupied",
      "confidence": 0.71,
      "vehicle_id": 3096
    },
    "11": {
      "status": "occupied",
      "confidence": 0.71,
      "vehicle_id": 3101
    },
    "12": {
      "status": "occupied",
      "confidence": 0.71,
      "vehicle_id": 3102
    },
    "13": {
      "status": "occupied",
      "confidence": 0.71,
      "vehicle_id": 3103
    },
    "14": {
      "status": "occupied",
      "confidence": 0.71,
      "vehicle_id": 3104
    },
    "15": {
      "status": "occupied",
      "confidence": 0.71,
      "vehicle_id": 3113
    },
    "16": {
      "status": "occupied",
      "confidence": 0.71,
      "vehicle_id": 3114
    },
    "17": {
      "status": "occupied",
      "confidence": 0.71,
      "vehicle_id": 3122
    },
    "18": {
      "status": "occupied",
      "confidence": 0.71,
      "vehicle_id": 3131
    },
    "19": {
      "status": "occupied",
      "confidence": 0.71,
      "vehicle_id": 3132
    },
    "20": {
      "status": "occupied",
      "confidence": 0.71,
      "vehicle_id": 3139
    },
    "21": {
      "status": "occupied",
      "confidence": 0.71,
      "vehicle_id": 3146
    },
    "22": {
      "status": "occupied",
      "confidence": 0.71,
      "vehicle_id": 3133
    },
    "23": {
      "status": "available",
      "confidence": null,
      "vehicle_id": null
    },
    "24": {
      "status": "available",
      "confidence": null,
      "vehicle_id": null
    },
    "25": {
      "status": "available",
      "confidence": null,
      "vehicle_id": null
    },
    "26": {
      "status": "available",
      "confidence": null,
      "vehicle_id": null
    },
    "27": {
      "status": "available",
      "confidence": null,
      "vehicle_id": null
    },
    "28": {
      "status": "available",
      "confidence": null,
      "vehicle_id": null
    },
    "29": {
      "status": "available",
      "confidence": null,
      "vehicle_id": null
    },
    "30": {
      "status": "available",
      "confidence": null,
      "vehicle_id": null
    },
    "31": {
      "status": "occupied",
      "confidence": 0.71,
      "vehicle_id": 3094
    },
    "32": {
      "status": "available",
      "confidence": null,
      "vehicle_id": null
    },
    "33": {
      "status": "occupied",
      "confidence": 0.71,
      "vehicle_id": 3095
    },
    "34": {
      "status": "available",
      "confidence": null,
      "vehicle_id": null
    },
    "35": {
      "status": "occupied",
      "confidence": 0.71,
      "vehicle_id": 3105
    },
    "36": {
      "status": "occupied",
      "confidence": 0.71,
      "vehicle_id": 3115
    },
    "37": {
      "status": "occupied",
      "confidence": 0.71,
      "vehicle_id": 3116
    },
    "38": {
      "status": "occupied",
      "confidence": 0.71,
      "vehicle_id": 3106
    },
    "39": {
      "status": "available",
      "confidence": null,
      "vehicle_id": null
    },
    "40": {
      "status": "available",
      "confidence": null,
      "vehicle_id": null
    },
    "41": {
      "status": "occupied",
      "confidence": 0.71,
      "vehicle_id": 3134
    },
    "42": {
      "status": "available",
      "confidence": null,
      "vehicle_id": null
    },
    "43": {
      "status": "occupied",
      "confidence": 0.71,
      "vehicle_id": 3140
    },
    "44": {
      "status": "available",
      "confidence": null,
      "vehicle_id": null
    },
    "45": {
      "status": "occupied",
      "confidence": 0.71,
      "vehicle_id": 3088
    },
    "46": {
      "status": "available",
      "confidence": null,
      "vehicle_id": null
    },
    "47": {
      "status": "occupied",
      "confidence": 0.71,
      "vehicle_id": 3107
    },
    "48": {
      "status": "occupied",
      "confidence": 0.71,
      "vehicle_id": 3108
    },
    "49": {
      "status": "occupied",
      "confidence": 0.71,
      "vehicle_id": 3080
    },
    "50": {
      "status": "occupied",
      "confidence": 0.71,
      "vehicle_id": 3117
    },
    "51": {
      "status": "occupied",
      "confidence": 0.71,
      "vehicle_id": 3082
    },
    "52": {
      "status": "occupied",
      "confidence": 0.71,
      "vehicle_id": 3123
    },
    "53": {
      "status": "occupied",
      "confidence": 0.71,
      "vehicle_id": 3083
    },
    "54": {
      "status": "occupied",
      "confidence": 0.71,
      "vehicle_id": 3124
    },
    "55": {
      "status": "occupied",
      "confidence": 0.71,
      "vehicle_id": 3084
    },
    "56": {
      "status": "occupied",
      "confidence": 0.71,
      "vehicle_id": 3125
    },
    "57": {
      "status": "occupied",
      "confidence": 0.71,
      "vehicle_id": 3126
    },
    "58": {
      "status": "occupied",
      "confidence": 0.71,
      "vehicle_id": 3109
    },
    "59": {
      "status": "occupied",
      "confidence": 0.71,
      "vehicle_id": 3135
    },
    "60": {
      "status": "occupied",
      "confidence": 0.71,
      "vehicle_id": 3136
    },
    "61": {
      "status": "occupied",
      "confidence": 0.71,
      "vehicle_id": 3098
    },
    "62": {
      "status": "occupied",
      "confidence": 0.71,
      "vehicle_id": 3141
    },
    "63": {
      "status": "occupied",
      "confidence": 0.71,
      "vehicle_id": 3110
    },
    "64": {
      "status": "occupied",
      "confidence": 0.71,
      "vehicle_id": 3137
    },
    "65": {
      "status": "occupied",
      "confidence": 0.71,
      "vehicle_id": 3118
    },
    "66": {
      "status": "occupied",
      "confidence": 0.71,
      "vehicle_id": 3111
    },
    "67": {
      "status": "occupied",
      "confidence": 0.71,
      "vehicle_id": 3127
    },
    "68": {
      "status": "occupied",
      "confidence": 0.71,
      "vehicle_id": 3142
    },
    "69": {
      "status": "occupied",
      "confidence": 0.71,
      "vehicle_id": 3119
    },
    "70": {
      "status": "occupied",
      "confidence": 0.71,
      "vehicle_id": 3089
    },
    "71": {
      "status": "occupied",
      "confidence": 0.71,
      "vehicle_id": 3076
    },
    "72": {
      "status": "occupied",
      "confidence": 0.71,
      "vehicle_id": 3073
    },
    "73": {
      "status": "occupied",
      "confidence": 0.71,
      "vehicle_id": 3077
    },
    "74": {
      "status": "occupied",
      "confidence": 0.71,
      "vehicle_id": 3120
    },
    "75": {
      "status": "occupied",
      "confidence": 0.71,
      "vehicle_id": 3128
    },
    "76": {
      "status": "occupied",
      "confidence": 0.71,
      "vehicle_id": 3129
    },
    "77": {
      "status": "occupied",
      "confidence": 0.71,
      "vehicle_id": 3112
    },
    "78": {
      "status": "occupied",
      "confidence": 0.71,
      "vehicle_id": 3074
    },
    "79": {
      "status": "occupied",
      "confidence": 0.71,
      "vehicle_id": 3099
    },
    "80": {
      "status": "occupied",
      "confidence": 0.71,
      "vehicle_id": 3121
    },
    "81": {
      "status": "occupied",
      "confidence": 0.71,
      "vehicle_id": 3100
    },
    "82": {
      "status": "occupied",
      "confidence": 0.71,
      "vehicle_id": 3078
    },
    "83": {
      "status": "occupied",
      "confidence": 0.71,
      "vehicle_id": 3138
    },
    "84": {
      "status": "occupied",
      "confidence": 0.71,
      "vehicle_id": 3130
    },
    "85": {
      "status": "occupied",
      "confidence": 0.71,
      "vehicle_id": 3143
    },
    "86": {
      "status": "occupied",
      "confidence": 0.71,
      "vehicle_id": 3144
    },
    "87": {
      "status": "occupied",
      "confidence": 0.71,
      "vehicle_id": 3147
    },
    "88": {
      "status": "occupied",
      "confidence": 0.71,
      "vehicle_id": 3145
    },
    "89": {
      "status": "available",
      "confidence": null,
      "vehicle_id": null
    },
    "90": {
      "status": "available",
      "confidence": null,
      "vehicle_id": null
    },
    "91": {
      "status": "occupied",
      "confidence": 0.71,
      "vehicle_id": 3148
    },
    "92": {
      "status": "available",
      "confidence": null,
      "vehicle_id": null
    },
    "93": {
      "status": "available",
      "confidence": null,
      "vehicle_id": null
    },
    "94": {
      "status": "available",
      "confidence": null,
      "vehicle_id": null
    },
    "95": {
      "status": "available",
      "confidence": null,
      "vehicle_id": null
    },
    "96": {
      "status": "available",
      "confidence": null,
      "vehicle_id": null
    },
    "97": {
      "status": "available",
      "confidence": null,
      "vehicle_id": null
    },
    "98": {
      "status": "available",
      "confidence": null,
      "vehicle_id": null
    },
    "99": {
      "status": "available",
      "confidence": null,
      "vehicle_id": null
    },
    "100": {
      "status": "available",
      "confidence": null,
      "vehicle_id": null
    }
  },
  "cars": [
    {
      "id": 3085,
      "x": 0.263,
      "y": 0.0813,
      "spot_id": "1"